[
  {
    "event_version": "1.0",
    "event_type": "panic.button",
    "event_id": "a1b2c3d4-e5f6-4a7b-8c9d-0e1f2a3b4c5d",
    "producer": "test",
    "source": "simulated",
    "correlation_id": "f6e7d8c9-b0a1-4f2e-3d4c-5b6a7e8f9d0e",
    "trace_id": "d8e9f0a1-b2c3-4d5e-6f7a-8b9c0d1e2f3a",
    "timestamp": "2025-10-18T10:00:00.000Z",
    "partition_key": "panic.button",
    "geo": {
      "zone": "zone_test",
      "lat": 14.62,
      "lon": -90.52
    },
    "severity": "critical",
    "payload": {
      "tipo_de_alerta": "panico",
      "identificador_dispositivo": "BTN-999",
      "user_context": "movil"
    }
  },
  {
    "event_version": "1.0",
    "event_type": "sensor.lpr",
    "event_id": "b2c3d4e5-f6a7-4b8c-9d0e-1f2a3b4c5d6e",
    "producer": "test",
    "source": "simulated",
    "correlation_id": "c3d4e5f6-a7b8-4c9d-0e1f-2a3b4c5d6e7f",
    "trace_id": "e5f6a7b8-c9d0-4e1f-2a3b-4c5d6e7f8a9b",
    "timestamp": "2025-10-18T10:01:00.000Z",
    "partition_key": "sensor.lpr",
    "geo": {
      "zone": "zone_test",
      "lat": 14.62,
      "lon": -90.52
    },
    "severity": "warning",
    "payload": {
      "placa_vehicular": "ABC999",
      "velocidad_estimada": 95,
      "modelo_vehiculo": "sedan",
      "color_vehiculo": "negro",
      "ubicacion_sensor": "test_sensor_01"
    }
  }
]
